url,title
https://blog.naver.com/duthe/223281094883,송파 / 백정집 : 가브리살 목살 껍데기 물냉면까지 문정동 고기집 최강자로 인정
https://blog.naver.com/hsi822/223631481307,문정동고기집 육즙이 끝내주는 삼겹살 송파백정집
https://blog.naver.com/couppli1/223482935965,[송파 백정집] 육즙가득 친절가득했던 문정동 고깃집
https://blog.naver.com/ajtwoddl33/223316519668,[송파] 백정집 :: 조선식육식당 장지역 고기집 추천
https://blog.naver.com/whtjsdud3920/223545454449,"문정삼겹살 백정집 ""재방문 100% 송파고기맛집 문정하비오 맛집 인정"""
https://blog.naver.com/tmf5830a/223305076499,[송파/백정집] 잠실 송파 문정역 가브리살 삼겹살 맛집 문정동고기집 후기
https://blog.naver.com/iwalktoeat/223552168991,"[송파] 돼지고기에 진심, 숯불 장지역고기집 백정집 후기"
https://blog.naver.com/sisi-mom/223304620993,송파 백정집 문정동 파크하비오 삼겹살 맛집
https://blog.naver.com/j5240/223440043859,문정 송파 파크하비오 맛집 : 고기보다 껍데기에 반한 ‘백정집’
https://blog.naver.com/kettlechip/223520537590,"[송파] 백정집: 가브리살이 이렇게 맛있었나!? 문정동 고깃집, 장지역 고기집"
https://blog.naver.com/hazelpeace/223323513325,파크하비오 문정삼겹살 송파고깃집 가브리살 목살 맛집 백정집
https://blog.naver.com/scorch0/223570071373,송파 장지역 파크하비오 돼지고기 백정집 삼겹살
https://blog.naver.com/eungang_eungang/223436219780,서울 송파 식당 백정집
https://blog.naver.com/joiejo/223536220173,송파 문정동 장지역 존맛 고깃집 ‘백정집’ 가브리살&목살 후기!!
https://blog.naver.com/xhsl1992/223497294658,문정삼겹살 송파 백정집 가브리살 목살 안 먹으면 후회할 맛
https://blog.naver.com/eunishero/223313245268,문정동고기집 송파 파크하비오 숯불구이 백정집
https://blog.naver.com/gudsla1002/223322652479,"[송파] 백정집/ 문정동고기집, 문정동맛집"
https://blog.naver.com/laumi22/223250760680,송파고깃집 삼겹살집 찾는다면 레트로한 분위기의 백정집:친절함은 덤
https://blog.naver.com/doremifas_ol/223469208058,[문정동 고기집] 송파 파크하비오 맛집 백정집
https://blog.naver.com/juby_box/223536578325,[송파] 백정집/ 독특한 컨셉의 고기자체가 맛있는 집 !
https://blog.naver.com/joov__v/223656457431,[장지역고기집]백정집 숯불에 구워먹는 맛있는 가브리살 목살 송파 파크하비오 맛집
https://blog.naver.com/i_am_bambi/223310586347,백정집 | 장지역 송파하비오 모임하기 좋은 삼겹살 맛집
https://blog.naver.com/pooh3692/223444842911,송파 문정 맛집 백정집 육즙 가득 채운 고기 회식 장소 추천
https://blog.naver.com/camrin_hui/223647798688,[송파맛집]백정집_한돈이 좋은 것이 여~
https://blog.naver.com/sdsh403/223553573433,"[송파/문정] 문정동고기집 가브리살&목살맛집 ""백정집"""
https://blog.naver.com/gksdmaaka/223358796192,송파 백정집 육즙 팡팡 목살이 맛있는 장지역 고깃집
https://blog.naver.com/chya101/223596194160,[문정동 맛집] 송파 파크하비오 문정동 고기집 백정집 추천
https://blog.naver.com/comita11/223537748956,송파/장지역 삼겹살 맛집 백정집 솔직 후기
https://blog.naver.com/heesooo3/223645255631,[송파] 백정집 - 문정 삼겹살/ 문정동 고기집
https://blog.naver.com/chloetae/223214087070,"[송파/문정] 송파 핫플레이스, 조선정육식당 백정집에서 맛있는 목살 먹고왔어요! (+메뉴판)"
https://blog.naver.com/luv_scjw/223460893434,"서울 송파 백정집 주차 가능한 문정동 고기집 목살, 가브리살 추천"
https://blog.naver.com/matcumentary/223291696619,송파 문정동 고기집 문정삼겹살 가브리살이 맛있는 백정집
https://blog.naver.com/mukgoganda/223646798244,송파 장지역 삼겹살 맛집 백정집 문정동 고기집
https://blog.naver.com/haruu_-b/223648484207,서울 송파 문정동 고깃집 ‘백정집’ 장지역 가든파이브 근처 맛집
https://blog.naver.com/slsksh77/223323515852,"[송파/백정집]-문정동 맛집,송파목살이 끝내주는 백정집"
https://blog.naver.com/kitty5117/223669874591,"[송파] 남다른 고기 퀄리티, 문정동고기집 | 백정집"
https://blog.naver.com/or_mango/223660787666,송파/장지 (백정집) 가브리살 통통한 문정동고기집
https://blog.naver.com/tp08624/223494367834,"[서울/송파] 장지 문정동 삼겹살 고기집 가브리살 추천 백정집 (위치, 메뉴, 가격, 주차)"
https://blog.naver.com/hehe2028/223674419161,[송파] 육즙 가득 목살 장지역 고기집 백정집
https://blog.naver.com/howdeepq/223490443667,송파 파크하비오 백정집 고기맛집
https://blog.naver.com/heen1015/223330689997,서울/송파 백정집 문정동고깃집 파크하비오 장지역고기집 목살 가브리살
https://blog.naver.com/jeun_222/223345291424,"서울 송파 - 백정집, 문정삼겹살, 회식장소 추천, 문정"
https://blog.naver.com/berrynight/223277788175,송파 문정 삼겹살 맛집 백정집
https://blog.naver.com/beeemybaby/223333945611,백정집 / 송파하비오에 웨이팅하는 문정동고기집
https://blog.naver.com/wlgml2131/223484535070,송파 문정동 장지역 사이즈 잘나오는 두툼한 돼지고기 맛집ㅣ백정집
https://blog.naver.com/melanie227/223353592837,"송파 문정 맛집, 문정역 고기집 추천! 두툼한 삼겹살이 맛있는 백정집"
https://blog.naver.com/goandeat/223662586169,"[송파, 문정] 재방문한 숯불구이 맛집, 백정집"
https://blog.naver.com/cho_anna__/223558590767,「서울 송파」 백정집 / 파크하비오 근처 고기 맛집
https://blog.naver.com/95yulee/223564427423,"[서울맛집] 서울 문정삼겹살, 송파 파크하비오 장지역고기집 추천 - 백정집"
https://blog.naver.com/shkhs34/223544381052,송파 파크하비오 문정동 고기집 백정집
https://blog.naver.com/sujin6053/223402704752,송파 문정동 백정집 육질좋은 가브리살 고기 맛집 회식장소로 딱
https://blog.naver.com/yuun923/223313812931,[서울 송파] 백정집 | 돼지고기가 맛있는 장지역고기집
https://blog.naver.com/narang0514/223593129839,"[문정/장지/송파 맛집]동네 주민들 단백질 충전의 성지, 백정집 ^^힘숨찐 옛날 도시락 최고최고입니다"
https://blog.naver.com/ray_s/223358806495,송파 문정역 장지역 맛집: 백정집 feat. 목살 가브리살 하이볼
https://blog.naver.com/ggongnunaa/223492012620,[송파] 목살 가브리살이 맛있는 문정동고기집 백정집
https://blog.naver.com/agerenunc/223499153139,백정집 :: 송파 문정 파크하비오 가브리살 목살 삼겹살 존맛 강추 맛집
https://blog.naver.com/winterfresc/223600363564,송파 장지역 문정 파크하비오 삼겹살 고기 맛집 고기집 백정집
https://blog.naver.com/jjuming_g/223565521727,"[송파 문정] 핫한 문정동 고깃집 ""백정집"" 육즙터지는곳"
https://blog.naver.com/letter1029_/223250531140,송파 문정 삼겹살 맛집 백정집
https://blog.naver.com/goakfrdkdy/223336855808,송파 고깃집 문정역 맛집 파크하비오 주차 목살 육즙 팡팡 맛있는 백정집
https://blog.naver.com/paul_rosa/223675384203,[송파] 송리단길 맛집 잠실분식 마미떡 송파점
https://blog.naver.com/jbw0611/223644273290,송파맛집 마미떡 송파점 방문솔직후기
https://blog.naver.com/kdkk_/223460343358,송파나루역 떡볶이 맛집 분식 마미떡 송파점
https://blog.naver.com/only_day_/223507264201,[잠실/송파] 송리단길 분식 맛집: 국물떡볶이 튀김 맛집 '마미떡 송파점'
https://blog.naver.com/samsara28/223427135399,"송파 맛집 즉석떡볶이 맛집 송리단길 분식집, '마미떡 송파점'"
https://blog.naver.com/nalheelee/223548929553,송파 송리단길 즉석 떡볶이 '마미떡 송파점' 인기 많은 이유
https://blog.naver.com/skduddl1900/223508181697,송파나루역 송리단길 즉석떡볶이 맛집 마미떡 송파점
https://blog.naver.com/you_eat_today/223306175930,잠실송파 송리단길 즉석떡볶이맛집 | 마미떡 송파점 | 미역떡볶이 볶음밥 무한리필 | 송파나루역 송리단길맛집
https://blog.naver.com/happylakii/223475053067,[송파/잠실] 원조 미역떡볶이 맛집: 마미떡 송파점
https://blog.naver.com/num094/223617185993,송파즉석떡볶이 송파맛집 마미떡 송파점
https://blog.naver.com/musike1133/223468285454,송파 맛집: 송파 즉석떡볶이 맛집 '마미떡 송파점' 방문후기(+주차)
https://blog.naver.com/kimgl0727/223491218520,[서울 송파] 마미떡 송파점 | 송파맛집 송파동맛집 잠실분식 송리단길 맛집
https://blog.naver.com/vv_inee/223504596900,"[송파 잠실] 신상 송리단길 맛집, 마미떡 즉석떡볶이 송파점"
https://blog.naver.com/sunakimha/223439684438,[송파 송리단길 맛집] 즉석떡볶이 맛집 “마미떡 송파점”
https://blog.naver.com/loveandwork_/223534464096,"송파나루역 잠실역 떡볶이 맛집, 마미떡 송파점"
https://blog.naver.com/tteokrai/223444620449,송파나루역떡볶이｜특색있는 미역떡볶이 마미떡 송파점
https://blog.naver.com/hsk1005/223623852751,"[송리단길맛집] 볶음밥 무료로 즐기는 즉석떡볶이, 마미떡 송파점"
https://blog.naver.com/ajtwoddl33/223508748049,[잠실] 마미떡 송파점 :: 즉석떡볶이 송리단길 맛집
https://blog.naver.com/aanjellaya/223511737367,송파 맛집 마미떡 송파점 송리단길 맛집 잠실분식 떡볶이와 볶음밥까지 푸짐한 분식 맛집
https://blog.naver.com/hotomoi/223476280140,송파나루역떡볶이 맛집 ‘마미떡 송파점’
https://blog.naver.com/anjdiwjd/223472882489,"송리단길 맛집, 볶음밥이 무료! 마미떡 송파점"
https://blog.naver.com/tp08624/223489270563,"[서울/송파] 잠실 송리단길 분식 맛집 마미떡 송파점 (위치, 메뉴, 가격, 주차 등)"
https://blog.naver.com/sgm04257/223625283149,"[서울 송파 현지인 추천맛집] 레트로 감성에 추억의 그맛, 마미떡 송파점"
https://blog.naver.com/minpil0312/223549982484,송리단길 분식 맛집 감칠맛 반한 즉석떡볶이 혼술 가능한 마미떡
https://blog.naver.com/danchuhouse0223/223501581295,송파맛집 : 마미떡 송파점 (즉석떡볶이)
https://blog.naver.com/with__mong/223481821164,송파맛집 미역이 들어간 즉석떡볶이 마미떡 송파점
https://blog.naver.com/daegun7007/223261693924,마미떡 송파점 고급스러운 분위기
https://blog.naver.com/sanmaum03/223364765479,"02.25 잠실-송파 즉석 떡볶이 맛집 마미떡 송파점(feat. 미역떡볶이, 파채튀김)"
https://blog.naver.com/juu0124/223466921640,|송리단길 맛집|송파 즉석떡볶이 마미떡 송파점
https://blog.naver.com/seul_eeee/223618292140,잠실 송리단길 맛집 마미떡 송파점 매력있는 미역 즉석떡볶이 웨이팅맛집
https://blog.naver.com/vitaho/223433203437,송파 송리단길 미역 들어간 즉석떡볶이 맛집 마미떡
https://blog.naver.com/eun1108/223498563248,[송파] 마미떡 송파점 : 송리단길 즉석떡볶이맛집 데이트코스로 강추
https://blog.naver.com/anonan/223459303269,[서울 송파나루역 맛집] '마미떡 송파점' 송리단길 맛집 · 잠실 떡볶이 추천
https://blog.naver.com/qkrthwjd001/223345375816,"마미떡 송파점 - 잠실,송파 떡볶이 즉떡 맛집 강추"
https://blog.naver.com/memo_ry_0/223656237149,미역 원조 즉석 떡볶이 맛집 추천 송리단길 마미떡 송파점
https://blog.naver.com/thismonet/223492887028,"맛집 | [서울_송파] 송리단길 즉석 떡볶이 맛집, [서울_송파] ‘마미떡 송파점’ 방문 후기, 볶음밥 무한 리필"
https://blog.naver.com/ssunjj_blog/223662804311,"송리단길 맛집 잠실 분식 추천, 마미떡 송파점"
https://blog.naver.com/jview93/223634795863,[잠실 즉석떡볶이 맛집] 마미떡 송파점 내돈내산 후기
https://blog.naver.com/d__rae/223311750937,[서울/송파] 마미떡 송파점
https://blog.naver.com/zuhaha/223662330197,즉석떡볶이가 맛있는 잠실분식 마미떡 송파점
https://blog.naver.com/jennie_2/223439294151,송파 맛집 잠실 맛집 송리단길 맛집 마미떡 송파점
https://blog.naver.com/gugaring/223444627141,"[서울/송파] 마미떡 송파점, 송리단길 맛집 추천, 메뉴, 자리, 주차"
https://blog.naver.com/duvot/223465131237,[송파나루역떡볶이] 레트로 감성 송리단길 즉석떡볶이 마미떡 송파점
https://blog.naver.com/thdml18/223666582859,[잠실/서울]송리단길맛집/잠실맛집/잠실떡볶이 내돈내산 마미떡 송파점 솔직후기
https://blog.naver.com/eui_on/223403130150,석촌호수 맛집 추천 송파나루역 근처 즉석떡볶이 맛집 ‘마미떡 송파점’
https://blog.naver.com/pororin_hamong/223657039245,즉석떡볶이가 먹고싶을때 가기좋은 잠실분식집 '마미떡 송파점'
https://blog.naver.com/mangdo-eating-mango/223641684540,볶음밥이 무제한 미역이 들어간 톡특한 즉석떡볶이 잠실 분식 마미떡 송파점
https://blog.naver.com/haheho_o/223422797985,송리단길 분식집 마미떡 송파점 대만족!
https://blog.naver.com/coco_8600/223529853409,주차되는 잠실분식 송리단길 즉석떡볶이 마미떡 송파점
https://blog.naver.com/drawdream_1/223473113887,송파 떡볶이 마미떡 추억의 즉석떡볶이 가성비 맛집 추천!
https://blog.naver.com/wnsgml880/223660074740,서울/잠실 송리단길맛집으로 통하는 즉석떡볶이와 볶음밥을 무한으로 즐길수 있는
https://blog.naver.com/rubl0916/223656137461,송리단길 맛집 마미떡 송파점 잠실분식
https://blog.naver.com/peopleandlawkim/223656008964,송리단길 맛집 마미떡 송파점을 다녀오다
https://blog.naver.com/dlrlfdk13/223624563258,"잠실분식, 마미떡 송파점 - 떡순튀 세트, 어묵탕, 볶음밥까지"
https://blog.naver.com/jennyroom2/223672849575,(송리단길 맛집) 즉석떡볶이 마미떡 송파점
https://blog.naver.com/gamjamaru-/223526103966,가성비 좋은 잠실 분식 맛집 마미떡 송파점
https://blog.naver.com/bangedong123/223426470000,송리단길 즉석떡볶이 마미떡 송파점
https://blog.naver.com/yumgam030/223659982208,잠실 송리단길 즉석떡볶이 맛집 마미떡 송파점
https://blog.naver.com/seon_ah0126/223621214849,마미떡 송파점 :: 무한리필 무료볶음밥이 있는 송리단길 떡볶이 맛집 잠실분식
https://blog.naver.com/arumi__/223626167086,잠실분식 마미떡 송파점 미역 즉석떡볶이 튀김맛집
https://blog.naver.com/haenemiyo/223542095994,송파 문정동 맛집 법조단지 점심 혼밥 추천 시온텐동 후기
https://blog.naver.com/myoungho1111/223668373901,[서울 송파] 시온텐동 : 바삭바삭한 튀김과 함께 : 문정동 맛집
https://blog.naver.com/sisi-mom/223403206369,문정동 맛집 시온텐동 송파 법조타운 튀김덮밥 전문점
https://blog.naver.com/seoj6677/223558343453,송파ㅣ시온텐동 문정동 법조단지 현대지식산업센터 줄서는 튀김덮밥집
https://blog.naver.com/minjung685/223657165922,[송파]문정동맛집 시온텐동 텐동맛집 찾는다면 바로여기
https://blog.naver.com/lovely_hanol/223571669126,송파 문정동맛집 '시온텐동' 점심 메뉴 추천
https://blog.naver.com/melanie227/223356777346,"송파 문정동 맛집, 점심 메뉴로 텐동 추천! 시온텐동"
https://blog.naver.com/khgee91/223555517065,서울 송파 문정역 텐동 맛집 점심뭐먹지 시온텐동
https://blog.naver.com/jurie64901/223331512895,송파 문정역 맛집 점심메뉴 추천 혼밥 가능 일식 - 시온텐동
https://blog.naver.com/eunk2010/223307316996,[송파] 시온텐동_ 바삭한 튀김이 푸짐한 텐동맛집
https://blog.naver.com/tulip7772/223551838478,송파 문정동점심 텐동맛집 시온텐동 방문후기
https://blog.naver.com/sunyeong_419/223212746905,[송파] 시온텐동 | 문정역 튀김덮밥 정식 먹어봤어요
https://blog.naver.com/rlo_bi_/223561497378,서울 송파 문정동 맛집 시온텐동 문정동점심 추천 텐동맛집
https://blog.naver.com/goandeat/223564799233,"[송파, 문정] 기다릴 수 밖에 없는 문정동 텐동집, 시온텐동"
https://blog.naver.com/bysthebest/223343478399,송파 문정동 문정역 튀김 맛집 [시온 텐동] 혼밥 주차
https://blog.naver.com/xoxobbii/223323813491,[송파/문정역] 시온텐동 : 직장인 찐 텐동 맛집
https://blog.naver.com/okjjii_o/223529243532,시온텐동_ 송파 문정동 텐동 맛집
https://blog.naver.com/nominjeong/223499193837,[송파/문정] 문정동점심 시온텐동
https://blog.naver.com/aisiaufamily/223472129394,문정동텐동 > 텐동맛집 여기 문정동점심 '시온텐동'
https://blog.naver.com/ddoheeee_0/223063964883,"[송파 문정 텐동]문정 법조단지 식당 추천|든든한 점심 한 끼는 시온텐동, 커피는 마쿠렌"
https://blog.naver.com/wkdskfk3947/223176472411,송파/강동 내돈내산 맛집 정리
https://blog.naver.com/heen1015/223284086483,서울/송파 문정동점심 가성비 좋고 푸짐한 텐동맛집 시온텐동 문정동텐동
https://blog.naver.com/idella/223427361211,문정동맛집 가성비 좋고 맛 좋은 시온텐동
https://blog.naver.com/tlfqj6880/223361436586,[서울/문정] 시온텐동_문정법조타운 혼밥 맛집 점심 혼밥 추천 문정지식산업센터 맛집
https://blog.naver.com/yonizzaang/223567401342,텐동이 땡기나요? 송파 텐동맛집 시온텐동
https://blog.naver.com/soin555/223342046851,송파 문정 시온텐동 문정동맛집 텐동맛집
https://blog.naver.com/regina0-0/223324451877,[송파/문정] 시온텐동_ 문정동 텐동 맛집
https://blog.naver.com/unasuna/223309525808,송파 텐동맛집 - 시온텐동
https://blog.naver.com/kimgl0727/223332396303,[서울 송파] 시온텐동 | 문정동맛집 문정동점심 문정동텐동 점심뭐먹지 문정동가볼만한곳
https://blog.naver.com/funnyeatyamyam/223301896558,"[시온텐동/문정] 송파에서 유명한 일식 맛집, 시온텐동 #송파맛집 #문정맛집 #"
https://blog.naver.com/thismonet/223477178898,"맛집 | [서울_송파] 문정 직장인 텐동 맛집, ‘시온텐동’ 방문 후기, 텐동 맛있게 먹는 방법"
https://blog.naver.com/seohee109/223248842256,"송파 문정동 점심 추천 텐동 맛집, 시온텐동"
https://blog.naver.com/kikiki125/223425486659,[송파] 문정동맛집 튀김요리가 땡길 땐 '시온텐동'
https://blog.naver.com/bom_nall/222887426360,"[문정동] 시온텐동/튀김덮밥, 문정법조타운 신상 텐동집"
https://blog.naver.com/shsh_7672/222910323269,10월. 마에스트로부동산
https://blog.naver.com/dazzling1992/223540123570,문정역 직장인 점심 텐동맛집 시온텐동 후기(밥과 국 리필가능)
https://blog.naver.com/ibelongtoyou_/223326625044,"서울 송파, 북해도 / 시온텐동 / 한아람"
https://blog.naver.com/lovesong_j_k/223506528158,[송파 맛집] 튀김이 바삭바삭한 시온텐동
https://blog.naver.com/lillillillilil/223532098045,[송파_문정] 문정법조타운 시온텐동 내돈내산 오픈런후기
https://blog.naver.com/simsimdiary/223659309290,문정 맛집 회전율이 빠른 시온텐동
https://blog.naver.com/kimx2772/223047906462,송파 맛집 시온텐동 느끼하지 않고 끝까지 맛있게 먹은 텐동
https://blog.naver.com/jeewong10/223569671801,[ ✈️ 맛집투어 ] 바삭바삭한 튀김옷과 부드러운 튀김들이 맛있었던 _ 시온텐동 문정역
https://blog.naver.com/laurier_blog/223592139546,문정동 텐동 맛집 시온텐동 점심 추천
https://blog.naver.com/kitty5117/223606828785,문정동 점심 맛집ㅣ시온텐동 메뉴추천 꿀팁
https://blog.naver.com/sszzu/222903982402,"[송파/문정] 괜찮은 덮밥집이 필요할때, <시온텐동>"
https://blog.naver.com/wanderer_ck/223314037377,[시온텐동 / 문정] 문정동 점심 텐동 맛집 (天丼)
https://blog.naver.com/x_xohe_e/223614914079,[문정동점심맛집] 점심시간에도 웨이팅있지만 회전율 좋아 대기시간 짧은 텐동맛집
https://blog.naver.com/namju0504/223470058736,문정동맛집 이 구역 텐동맛집!! 줄서서 먹는 시온텐동
https://blog.naver.com/biolab80/223614625290,문정역 직장인들의 점심 메뉴 추천 튀김이 바삭하고 맛있는 시온텐동
https://blog.naver.com/k016897/223561626090,문정동맛집 텐동맛집 시온텐동
https://blog.naver.com/agahee777/223619713638,문정역 텐동이 맛있는 점심 맛집 시온텐동
https://blog.naver.com/kusy9/223478118021,문정동 법조타운 점심 뭐 먹지 온센타마고 시온 텐동 먹는 법
https://blog.naver.com/deer_nahee/223320215491,문정동 텐동 맛집 직장인들의 인기 점심메뉴 시온텐동
https://blog.naver.com/qhfka7080/223323186831,[시온텐동] 문정동 점심 맛집 추천 : 튀김이 맛있는 시온텐
https://blog.naver.com/yeonjin430/223674859497,문정동텐동 점심뭐먹지 시온텐동
https://blog.naver.com/smst1973/223663678803,점심뭐먹지! 문정동 텐동 점심맛집 시온텐동에서~
https://blog.naver.com/signature_ddun/223490060654,시온텐동 가성비도 바삭함도 맛도 보장하는 맛집 문정동 후회없는 메뉴 추천 주차정보
https://blog.naver.com/littletoes75/223664512634,바삭바삭한 튀김이 일품인 문정동맛집 [시온텐동]
https://blog.naver.com/ldy107/223590912131,문정동텐동 | 문정 점심메뉴 추천 가성비 좋은 '시온텐동'
https://blog.naver.com/xeoseoxo/223084395802,[문정] 법조타운 점심 메뉴 추천 텐동 맛집 '시온텐동'
https://blog.naver.com/mykyunge/223665556264,방이동쪽갈비 맛집 단체모임장소 추천 매료쪽갈비찜 송파본점 후기
https://blog.naver.com/dobal23/223663866736,방이동 배달맛집 쪽갈비찜 전문점 [매료 쪽갈비짐 송파본점] | 잠실 회식 장소 추천
https://blog.naver.com/kimalsrl11/223639072304,매콤한 방이동 쪽갈비 전문 맛집 [매료쪽갈비찜 송파본점]
https://blog.naver.com/a-014/223646999074,방이동밥집 매료쪽갈비찜 송파본점 (주차장)
https://blog.naver.com/yapyap222/223645849279,맛있게 매운 방이동맛집 방이동쪽갈비 매료쪽갈비찜 송파본점
https://blog.naver.com/cyn9077/223664546138,"방이동 식당 방이동 쪽갈비 - 매료쪽갈비찜 송파본점 ; 주차, 메뉴, 솔직후기"
https://blog.naver.com/aldudaldud12/223666667280,방이동맛집 | 뜯는맛이 좋은 매콤한 쪽갈비 | 매료쪽갈비찜 송파본점
https://blog.naver.com/rusiy/223667825467,방이동 매운 쪽갈비찜 맛집 - 모임하기 좋은 매료쪽갈비찜 송파본점
https://blog.naver.com/01239s/223636857455,방이동 쪽갈비 맛집 매료쪽갈비찜 송파본점 방이동 식당 추천
https://blog.naver.com/savvygamja/223665291153,방이동 매운 쪽갈비 맛집 매료쪽갈비찜 송파본점
https://blog.naver.com/happyhappy415/223666011423,[송파] 방이동 식당 매료쪽갈비찜 송파본점
https://blog.naver.com/neighborchef/223637076141,[방이] 역대급으로 맛있었던 맛있게 매운 부드러운 쪽갈비찜 찐맛집!! 매료쪽갈비찜 송파본점
https://blog.naver.com/uvvuv/223598236226,서울 송파[매료쪽갈비찜 송파본점]먹기 편하고 부드러운 쪽갈비찜 맛집
https://blog.naver.com/dlrlfdk13/223660636477,"방이동 쪽갈비, 매료쪽갈비찜 송파본점 - 쪽갈비 맛집, 방이동 식당"
https://blog.naver.com/angela_0111/223646685672,"볶음밥까지도 맛있는 방이동 쪽갈비, 매료쪽갈비찜 송파본점"
https://blog.naver.com/95thvldk/223506751302,방이동맛집 '매료 쪽갈비찜 송파본점' : 강렬한 매운맛 쪽갈비로 스트레스 풀기
https://blog.naver.com/jain_im_/223570363084,방이동 맛집 매료쪽갈비 송파본점 묵은지가 맛있는 쪽갈비찜
https://blog.naver.com/idella/223472461094,송파쪽갈비찜 맛집 매료쪽갈비찜
https://blog.naver.com/jlovesjjj/223535941185,"[송파/방이/잠실] 매운맛이 땡길 때는, 새로 생긴 방이동 맛집 - 매료 쪽갈비"
https://blog.naver.com/isomuse/223649402569,"[송파] 방이동 식당, 방이동 쪽갈비, 맛있게 매콤한 매료쪽갈비 송파본점"
https://blog.naver.com/smallness21/223543341096,매료 되었던 방이동쪽갈비
https://blog.naver.com/bibi-bit/223668575306,[방이동 맛집] 방이동 쪽갈비 “매료쪽갈비찜 송파본점” 매운 쪽갈비(3단계 후기)
https://blog.naver.com/kimgl0727/223643153745,[서울 송파] 매료쪽갈비찜 송파본점 | 방이동밥집 방이동식당 송파밥집 방이동쪽갈비 방이동맛집
https://blog.naver.com/uloveme75/223651496229,"송파쪽갈비 맛집 ""매료쪽갈비찜"" 송파본점"
https://blog.naver.com/silver_jins/223651079941,방이동 쪽갈비 송파밥집 매료쪽갈비찜
https://blog.naver.com/kimsb79/223542173114,"[매료 쪽갈비찜 송파본점] 辛쪽갈비찜세트, 홍주 막걸리 방이동갈비찜"
https://blog.naver.com/ongin_/223630821365,잠실 방이동 식당 매료쪽갈비찜 송파본점 방이동 쪽갈비 맛있는 곳
https://geniusjw.com/3258?category=146410,거여동 신사골감자탕 24시 8천원 뼈해장국 맛집
https://blog.naver.com/bellaye0n430/223629057363,"[서울/방이] 방이동 쪽갈비, 방이동 식당 매료쪽갈비찜 송파본점"
