url,title
https://blog.naver.com/jooida/223169281756,[돈받고는이렇게안씀] 개롱: 요쪽갈비찜 매운쪽갈비찜 후기
https://blog.naver.com/super_hj/223508857111,"방이동 맛집 매료쪽갈비찜 송파본점, 맛있게 매운 쪽갈비찜 보들보들 계란찜 필수"
https://blog.naver.com/pr1472/223344493788,"2일 2024년 2월 2일 신규사업자 개업 업체 가게 상가 점포 식품 : 음식점 호프, 레스코랑, 커피숍, 카페..."
https://blog.naver.com/qd486/223537665830,방이동맛집 매료쪽갈비찜 송파본점 가성비까지 좋아
https://blog.naver.com/universe_galaxy/223579293719,서울 송파 매료쪽갈비찜 방이동맛집 술집 추천
https://blog.naver.com/yri0326/223628053488,[송파밥집] 매료쪽갈비찜 송파본점 후기
https://blog.naver.com/mun1709/223501006118,[송파나루역 맛집]100%국내산 방이동쪽갈비 매료쪽갈비찜 송파본점
https://blog.naver.com/zzyongimda/223085497006,군산 맛집 야키니쿠 전문점 모토이시 나운점 특 와규6품세트 우설소금구이 내돈내산 솔직후기
https://blog.naver.com/bravozmylife/223282965670,레뷰 체험단 선정 리스트 (서울) - 20231204 품평단
https://blog.naver.com/daroad1112/222684214346,전국 맛집 리스트. feat.다로드 편집
https://blog.naver.com/yssy1231/222988832186,[tvN 줄서는식당] '줄서는 식당' 리스트 총정리 (25화~27화)
https://blog.naver.com/qualitor/223667870552,백프로 국내산 쪽갈비 방이동 식당 매료쪽갈비찜
https://blog.naver.com/dbwlsdl5/223648231717,방이동 쪽갈비 맛집 매료쪽갈비찜 방이동 식당 추천
https://blog.naver.com/ponergitive/223635986063,방이동맛집 '매료쪽갈비찜 송파본점' 매콤한게 생각날때.. 콜!!
https://blog.naver.com/ksky_0713/223649902915,잠실 방이동 쪽갈비 맛집 매료쪽갈비찜
https://blog.naver.com/daejangduck/223665370524,[송파/맛집] 올림픽공원맛집 롯데월드 방이동 식당 방이동쪽갈비 매료쪽갈비찜
https://blog.naver.com/minglog_0215/223540633935,방이동맛집 매료쪽갈비 송파본점 매콤하고 중독성있는 김치쪽갈비찜 맛집
https://blog.naver.com/leeasik/223505297339,방이동맛집 송파나루역맛집 매료쪽갈비찜 매료되는 맛
https://blog.naver.com/hwon9/223667290722,매콤한 방이동쪽갈비 맛집 매료쪽갈비찜
https://blog.naver.com/luv2017_/223650147308,잠실 방이동 맛집 매료쪽갈비찜 / 방이동 매콤한 쪽갈비 소주 한잔 후기
https://blog.naver.com/agahee777/223541173420,방이동맛집 국내산 쪽갈비 맛집인 매료쪽갈비 송파본점
https://blog.naver.com/coco_8600/223471161553,스트레스 타파 송파 매운갈비찜 방이동 쪽갈비 맛집 매료쪽갈비찜
https://blog.naver.com/ljh2s/223646188349,방이동 맛집 매료쪽갈비찜 추천
https://blog.naver.com/hwangs2ummer/223542958450,방이동맛집 매료쪽갈비찜 송파나루역 국물 쪽갈비 밥술집 추천
https://blog.naver.com/jinny_sosolife/223648447403,방이동 식당 매료쪽갈비찜 맛있게 매운 김치쪽갈비찜 세트메뉴 후기
https://blog.naver.com/ssyd36697/223578367941,매료 쪽갈비 송파나루역 방이동맛집 양도 넉넉하고 점심특선 있는 곳
https://blog.naver.com/yumyumnurse/223568540110,[냠냠] 방이동쪽갈비 맛집 매료쪽갈비
https://blog.naver.com/h_168/223576359519,방이역 맛집 송파 매료 쪽갈비 가족외식부터 소주 안주로도 안성맞춤인 방이동맛집 갈비찜 추천
https://blog.naver.com/minminchacha/223573667017,"스트레스 풀리는 매콤 칼칼 얼큰 쪽갈비 맛집 술이 쭉쭉 들어가는, 송파 방이동 “”"
https://blog.naver.com/mingmingguri/223622471640,[송파/방이] 방이동 매운쪽갈비 2단계 후기 - 매료쪽갈비찜
https://blog.naver.com/lovekeuny/223668260410,송파 방이동) 매료쪽갈비찜 밥술하기 좋은 맛집 발견
https://blog.naver.com/christina_happy_life/223562335227,[방이동 술집] 송파나루역 이자카야 켄홈 방이점
https://blog.naver.com/qhsntm/223667769627,"송파구 잠실 송파나루역 이자카야 추천, 켄홈 방이점"
https://blog.naver.com/sseojy0202/223539305778,<켄홈 방이점> 방이동술집 방이동이자카야 송파나루역이자카야 송리단길이자카
https://blog.naver.com/ko1dog/223522412758,방이동 이자카야 켄홈 방이점 맛있는 안주 오뎅탕에 반한 송파나루역 맛집
https://blog.naver.com/sn0427_/223511102848,송파나루역술집 켄홈 방이점 이자카야
https://blog.naver.com/gimunze/223261187666,"[송파] 특별한 오뎅탕이 있는 이자카야, 켄홈 방이점"
https://blog.naver.com/yhds0320/223336803428,[송파술집] 켄홈 방이점ㅣ철판요리와 하이볼이 있는 방이동 이자카야
https://blog.naver.com/95thvldk/223352144405,송파나루역술집 ‘켄홈 방이점’ : 방이먹자골목 사골육수 오뎅탕 맛집
https://blog.naver.com/playyul/223334711210,켄홈 방이점 : 방이동 이자카야 특오뎅탕 송파나루역 술집
https://blog.naver.com/amanwww/223328942499,방이동 이자카야 송파나루역 술집 켄홈 방이점 짐빔하이볼
https://blog.naver.com/heejea124/223276327979,일본 분위기의 송파나루역 이자카야 '켄홈 방이점' 특별한 안주가 있는 곳
https://blog.naver.com/youngkkong/223076489495,[송파나루역 술집] 켄홈 방이점 | 방이동 이자카야 추천 | 철판요리 솔직후기
https://blog.naver.com/0110pey/223482665473,"도쿄 어느거리 이자카야 같은,,, 송파나루역술집 켄홈 방이점"
https://blog.naver.com/kimgl0727/223328453770,[서울 송파] 켄홈 방이점 | 방이동술집 방이동이자카야 송파나루역술집 송파나루역이자카야 송파나루역술집
https://blog.naver.com/ckpark_/223515605880,송파 이자카야 켄홈 방이점에서 서울 속 작은 일본 여행을 즐겨요
https://blog.naver.com/mini_box_/223117245384,방이동술집 켄홈 방이점! 특별한 철판요리를 맛볼 수 있는 송파나루역술집
https://blog.naver.com/candor_/223112397239,방이동이자카야 켄홈 방이점 든든한 철판요리 송파나루역술집
https://blog.naver.com/hazelnutt7/223062854372,[송파나루 이자카야]해산물 가득 사골육수 오뎅탕 맛집 '켄홈 방이점' 주말방문후기(메뉴판/추천메뉴)
https://blog.naver.com/yejuc/223610729268,"[켄홈] 송파/송리단길/송파나루/방이동이자카야 재재방문 후기, 오뎅탕B 추천"
https://blog.naver.com/yd017017/223273381657,송파나루역 이자카야 켄홈 방이점 [일본식오뎅탕 하이볼]
https://blog.naver.com/rmsahd/223073975162,[방이동술집] 방이동이자카야 특별한 철판요리와 오뎅탕 '켄홈 방이점'
https://blog.naver.com/leem2428/223499256962,데이트코스를 찾는다면 송파이자카야 켄홈 방이점 추천해요
https://blog.naver.com/nextdoor_duck/223257612195,[서울/송파] 조용하고 특별한 메뉴가 있는 송파나루역술집 '켄홈 방이점'
https://blog.naver.com/hyunnhappy/223112398027,"[석촌/잠실] 송파나루역이자카야 ""켄홈 방이점"" 특오뎅탕 특철판치즈 야끼토리 맛집 추천"
https://blog.naver.com/greenuni/222829980068,방이동 이자카야 켄홈 방이점 다양한 재료의 철판치즈
https://blog.naver.com/s_u_n_m_i_n_g/223243711532,[송파나루역/맛집] 오뎅탕과 하이볼의 조합 : 이자카야 '켄홈 방이점'
https://blog.naver.com/bllluck/223501993814,방이동이자카야 켄홈 방이점 분위기 좋은 술집 혼술도 가능한 곳
https://blog.naver.com/9281129/223482938852,재료가득 불향 일본맛 가득한 오뎅탕 맛집 송파나루이자카야 켄홈 방이점
https://blog.naver.com/thddpfla7/223156624291,[송파나루역술집]방이동 먹자골목 이자카야 추천! ‘켄홈 방이점’
https://blog.naver.com/fallinlovejw_/223524126722,여기만의 시그니처메뉴가 또 생각나는 송파나루역맛집 켄홈 방이점에서 친구랑 다녀왔음
https://blog.naver.com/daeun8146/223235855108,방이동이자카야 켄홈 방이점 안주가 정말 맛있는 송파나루역술집
https://blog.naver.com/jinhee_sj/223022429525,"[송파나루역] 방이 먹자골목의 인생 오뎅탕, 켄홈 방이점"
https://blog.naver.com/eoslsorj45/223498286363,방이동술집 송파나루 이자카야찐추천 일본에 온거같은 분위기로 핫한 꿀데이트코스
https://blog.naver.com/gi2593/223511632072,"송파나루역맛집 혼술로 제격인 곳을 찾는 사람이 있다면, 켄홈 방이점"
https://blog.naver.com/jenny1369/223632311454,방이동 이자카야 아늑한 분위기 안주 맛집ㅣ켄홈 방이점ㅣ
https://blog.naver.com/knari12/223498523930,딱 내세대가 즐길수 있는 곳인거 같아 90~00년 음악으로 감성적인 분위기를 연출 술집
https://blog.naver.com/zzing_99/223512761383,송파나루역맛집 시끄럽지 않아 조용하게 대화하기 좋은 켄홈 방이점
https://blog.naver.com/ellie_28/223501434179,한국에서 만나는 일본 현지 분위기의 송파술집 켄홈방이점
https://blog.naver.com/ryudajung/223039247458,[잠실/송파나루 이자카야 추천_켄홈 방이점] 방이 먹자골목 1차 2차로 모두 다 만족스런 이자카야
https://blog.naver.com/hyemni1014/223031886799,송파나루역 켄홈방이점 :: 안주가 맛있는 이자카야 데이트코스 추천
https://blog.naver.com/lsj_pallas/223497948247,송파맛집 깊은 맛과 감칠맛이 더해진 켄홈 방이점
https://blog.naver.com/benny_123/223489723883,송파이자카야 조용해서 프라이빗하게 방문하기 좋은 켄홈 방이점
https://blog.naver.com/wndnjs7756/223487616536,송파이자카야 현지에 온 듯한 느낌 켄홈 방이점
https://blog.naver.com/tmvlfqjrm/223489355241,음악 선곡이 취향 저격인 송파맛집 켄홈방이점 안주도 취향 저격 사장님 저격수 맞죠
https://blog.naver.com/blossm1333/223485260038,송파이자카야 시끄럽지 않아 분위기가 좋은 켄홈 방이점
https://blog.naver.com/twotwo__225/223515336701,송파이자카야 켄홈 방이점에서 오랜만에 모임
https://blog.naver.com/hyuna723-97/223507754327,송파이자카야 친구들이랑 모임 켄홈 방이점
https://blog.naver.com/chdl0722/223493132775,"송파이자카야 중 깊은 여운을 남기는 이곳, 켄홈 방이점에 다녀온 후기"
https://blog.naver.com/qptjsl/223482542338,혼술도 가능하다고? 분위기 좋은 송파이자카야 켄홈 방이점
https://blog.naver.com/berberdd/223493555328,송파맛집 잠실에서 회식하면서 술한잔하기에 적당한 켄홈 방이점
https://blog.naver.com/namenaming/223639358602,잠실 맛집 추천 : 방이동 혼술하기 좋은 조용한 이자카야 켄홈
https://blog.naver.com/mort-_-/223234155477,"[송파/방이] 친구 따라 갔다가 맛있어서 또간집 이자카야 '켄홈' 방이점 (위치, 매장정보, 특철판치즈 후기)"
https://blog.naver.com/tiney_994/223510494688,송파맛집 서울 속 작은 일본여행이 가능한 켄홈 방이점
https://blog.naver.com/baby_bara/223579422865,[켄홈 방이점] 방이동 술집 일반오뎅탕이 아닌 알곤이매콤오뎅탕 핵찐추천!
https://blog.naver.com/dooitdooing/223568419053,"오뎅탕 맛집 방이동 이자카야, 켄홈 방이점 후기"
https://blog.naver.com/hnhhyn/223516663620,남자친구랑 즐거운 시간 보냈어 구경하는 재미가 있는 오픈 주방이 있는 송파나루역맛집
https://blog.naver.com/hyo_001/223514726662,서울 속 작은 일본여행을 하고 싶다면 송파이자카야 켄홈 방이점
https://blog.naver.com/biba_studio/223507152585,"송파나루역맛집 술 좋아하는 사람은 여기로, 다양한 종류의 술과 음식을 파는 이곳은"
https://blog.naver.com/abcd_hj/223471680282,"방이동 술집 켄홈 방이점, 오뎅탕이 맛있는 이자카야"
https://blog.naver.com/moneychaemi/223619800483,"방이동 이자카야 추천, 안주가 맛있는 ""켄홈 방이점"""
