url,title
https://blog.naver.com/jjhhii851/223651978325,"[강북/수유] 수유역맛집 쪽갈비맛집 추천, 와와쪽갈비 수유점"
https://blog.naver.com/thddl4126/223667272238,[강북] 수유역맛집 와와 쪽갈비 수유점 드디어 가봄
https://blog.naver.com/dodojjajja/223657704909,수유쪽갈비 맛집 와와 쪽갈비 수유점 방문 후기
https://blog.naver.com/wjddo1206/223674019982,계란찜와 돼지껍데기가 무한리필인 수유 쪽갈비 맛집 - 와와쪽갈비 수유점
https://blog.naver.com/alsghfmahs/223642320075,수유역 화계역 낮술 쪽갈비맛집 와와쪽갈비 - 돼지껍데기 무한리필 부드럽고 양많아요
https://blog.naver.com/mint_cat0812/223675221715,수유역 맛집 와와 쪽갈비 수유점
https://blog.naver.com/choi_nim_/223674983064,수유역맛집 와와쪽갈비 숯불직화구이 맛집
https://blog.naver.com/sunny970128/223671618219,수유역맛집 로컬 찐맛집 와와 쪽갈비 수유점
https://blog.naver.com/katsuya00/223665888869,수유고기집 와와 쪽갈비 수유점
https://blog.naver.com/wodudtldk/223674470719,[수유역 맛집 추천 :: 쪽갈비 맛도리] 와와 쪽갈비 수유점
https://blog.naver.com/7400071/223430900637,와와쪽갈비 노원점 직원분들이 정말 친절해요.
https://blog.naver.com/onlyone180/223654228597,수유역맛집 <와와 쪽갈비 수유점>아들과의 데이트
https://blog.naver.com/io_posso/223476739322,@와와쪽갈비 수유점 / 수유 맛집 / 화계역 맛집
https://blog.naver.com/kimrla95/223673736144,"수유역 맛집 통통한 쪽갈비가 일품, 와와 쪽갈비"
https://blog.naver.com/emanaya/223663231268,수유역 맛집 발견 와와쪽갈비 수유점
https://blog.naver.com/yulim2086/223643639987,수유역 맛집 밑반찬도 일품인 와와 쪽갈비 수유점
https://blog.naver.com/dd030_/223644517329,수유역맛집 수유리맛집 수유고기집 수유밥집 수유역밥집 와와 쪽갈비 수유점 모임장소추천
https://blog.naver.com/ch2683/223654908004,수유역맛집 수유리맛집 고기맛집 와와 쪽갈비 수유점
https://blog.naver.com/msm_9934/223659439327,[서울/수유] 돼지껍데기 무한리필 숯불초벌 ‘와와쪽갈비’
https://blog.naver.com/tmsla_zz/223650585006,[수유역 맛집] <와와쪽갈비 수유점> 초벌로 구워나오는 숯불향 가득한 쪽갈비 찐맛집 후기
https://blog.naver.com/chae2557/223656115847,"'와와 쪽갈비 수유점' 수유역 쪽갈비 맛집/계란찜, 껍데기 무한서비스"
https://blog.naver.com/hoony8355/223654203982,와와 쪽갈비 수유점 리뷰: 소주 한잔 하기 좋은 숨은 맛집
https://blog.naver.com/chlwlldus1234/223645427564,수유역 쪽갈비 맛집 와와 쪽갈비 수유점 추천
https://blog.naver.com/sooyoungparo7/223663149273,수유고기집 와와쪽갈비 맛있는 갈비맛보러 와와!! 렛츠기릿
https://blog.naver.com/imjunnnyyy/223665781955,[와와쪽갈비 수유점]수유역 맛집 쪽갈미 맛집 다녀왔슴둥!
https://blog.naver.com/p74ink/223653883781,"수유쪽갈비 ""와와 쪽갈비 수유점"""
https://blog.naver.com/hyunnnnn2/223656008783,수유역맛집 와와 쪽갈비 수유점 계란찜 돼지껍데기 무한으로 주는곳
https://blog.naver.com/alice__01/223645302617,수유역맛집 숯불직화구이로 더욱 맛있는 와와쪽갈비 수유점
https://blog.naver.com/pba02183/223664759676,강북 수유고기집 :: 와와쪽갈비 리뷰
https://blog.naver.com/romironi_92/223628399224,수유역맛집 와와쪽갈비에서 저녁 먹기
https://blog.naver.com/ptgull/223628982404,와와쪽갈비 수유점을 모르신다면 간첩!
https://blog.naver.com/minaloveg/223630406413,[수유역맛집]수유역 맛있게 회식하기 좋은 곳 와와쪽갈비
https://blog.naver.com/tnals1081/223588388889,"수유역 쪽갈비 맛집, 껍데기도 무한리필로 즐길 수 있는 와와쪽갈비"
https://blog.naver.com/xoxo_36/223589716494,"수유동, 화계역: 와와 쪽갈비 수유점"
https://blog.naver.com/oh_7ho/223602050768,수유 쪽갈비 맛집 추천 와와쪽갈비 돼지껍데기 무한리필 내돈내산
https://blog.naver.com/yeonhana91/223595948403,(광고)수유매운쪽갈비 와와 쪽갈비 수유점 맛있어서 반한곳 !!
https://blog.naver.com/tjstmd0533/223524296543,수유역 맛집 와와쪽갈비 숯불 직화구이
https://blog.naver.com/werewolf1103/223641321628,수유맛집 부드럽게 뜯을 수 있는 와와쪽갈비
https://blog.naver.com/woo4213/223395455466,수유역 맛집 | 와와쪽갈비 초벌 해서 나오는 맛있는 쪽갈비
https://blog.naver.com/elini87/223457276880,"[ 수유 쪽갈비 맛집 ] 껍데기, 계란찜이 무한리필되는 줄서는 쪽갈비 맛집_ft."
https://blog.naver.com/dalmoong_love/223262420358,와와쪽갈비 수유점 내돈내산
https://blog.naver.com/bible_nn/223207501505,수유 맛집_와와쪽갈비
https://blog.naver.com/jj_ykkkk/223535572990,숯불직화구이 와와쪽갈비 수유점
https://blog.naver.com/noon0987/223500012939,수유맛집 수유쪽갈비 가성비 좋은 와와쪽갈비 수유점
https://blog.naver.com/llxiahl1/223525540102,계란찜 껍데기 무한리필 골목맛집 와와쪽갈비 수유점
https://blog.naver.com/summerrrr_rr/223570121899,수유역 쪽갈비 맛집 계란찜과 돼지껍데기 무한리필 [와와쪽갈비]
https://blog.naver.com/yoon_02_seul/223483951887,아이들과도 함께가기 좋은 와와쪽갈비 수유점
https://blog.naver.com/dlwngml150777/223509557618,술안주로 생각나는 수유맛집 와와쪽갈비 수유점 방문
https://blog.naver.com/pingors/223424028674,저기압일땐 고기앞으로 수유 쪽갈비 맛집 [와와쪽갈비]
https://blog.naver.com/gpfla333333/223476039195,수유 찐맛집 와와쪽갈비 수유점
https://blog.naver.com/soon236757/223460149732,"수유맛집, 와와쪽갈비 수유점에서 배부르게 쪽갈비 먹고 왔어요"
https://blog.naver.com/yjkmc1/223105777716,수유리쪽갈비 맛집 와와쪽갈비♡
https://blog.naver.com/dnbnnews/223466787543,와와 쪽갈비 수유점 씨엠쏭
https://blog.naver.com/yeppi_710/223532677620,수유맛집 찾고 계신다면 와와쪽갈비 수유점으로
https://blog.naver.com/cherrycherry27/223099990064,잡내 안나고 깔끔하게 맛있는 와와쪽갈비 수유점 쪽길비 맛집 추천
https://blog.naver.com/namzizzang/223401307788,[수유역 숨은 맛집] 수유에서 쪽갈비가 먹고싶다면 와와쪽갈비
https://blog.naver.com/shin930125/223383626393,[ 와와쪽갈비 수유점 ] 쪽갈비맛집 가족외식추천
https://blog.naver.com/alswjd_1204/223523910129,친구들이랑 수유역 놀러가서 수유 맛집 뿌시기!
https://blog.naver.com/wooyeonys2/223325650065,[냠냠] 수유역 저녁추천 외식 쪽갈비 맛집(소금/간장/양념) - 와와쪽갈비
https://blog.naver.com/pinkjj311/223466557422,수유에서 맛있는 쪽갈비 먹기..라고 쓰고 수유 탐방기 라고 읽는ㅋㅋ
https://blog.naver.com/jjhhii851/223584696810,"[강북/수유] 수유역술집 이자카야 추천, 이자카야 토라 수유점"
https://blog.naver.com/thddl4126/223611962674,[강북] 수유역 가성비 술집 분위기 좋은 이자카야 토라
https://blog.naver.com/tmsla_zz/223588664706,[수유역 맛집] <이자카야 토라> 배불리 먹어도 저렴한 갓성비 술집 방문 찐후기
https://blog.naver.com/zlzltlsgp94/223666422026,"서울 수유 이자카야 / 이자카야 토라, 가성비 넘치는 이자카야 추천"
https://blog.naver.com/pba02183/223672144490,수유역 이자카야 토라//안주가 맛있는 가성비 좋은 술집
https://blog.naver.com/wjsrbfl1004/223635430547,수유역이자카야 가성비 좋은 토라 솔직 리뷰
https://blog.naver.com/zzaya52/223675014800,수유역맛집 술집 이자카야토라 수유 메뉴판
https://blog.naver.com/yomoo_x/223635412839,"수유역가성비술집 이자카야 토라 수유점, 소고기 타다끼가 9,900원"
https://blog.naver.com/jinpic_/223658046154,수유역 가성비 술집 추천 이자카야 토라 찐 후기
https://blog.naver.com/hyeonji_13/223620813282,수유역가성비술집 이자카야 토라 대형스크린술집 단체모임 추천
https://blog.naver.com/dugeng/223638674828,수유역 가성비 술집 추천 :: 꼬치가 맛있는 이자카야 토라
https://blog.naver.com/seo-foodfighter/223652274808,수유역가성비술집 이자카야 토라 방문 후기
https://blog.naver.com/bsa0737/223645933635,수유역 가성비 술집 아침 6시까지하는 이자카야 토라
https://blog.naver.com/yulim2086/223580886430,수유역 가성비 술집 퀄리티 높은 이자카야 토라 수유점
https://blog.naver.com/wjsdpwl57/223529050153,수유역 가성비 술집 이자카야 토라 내돈내산 간단 후기
https://blog.naver.com/154xx_/223612704965,[수유역 술집] 수유 가성비 술집 이자카야 토라
https://blog.naver.com/djatn159/223610098014,"[수유] 이자카야토라 : 가성비도 좋고, 분위기도 좋은 수유역 이자카야"
https://blog.naver.com/congji0830/223609849503,[수유역 맛집] 이자카야토라 수유점_가성비에... 수유이자카야토라 / 강북구이자카야/ 수유야장)
https://blog.naver.com/hhusny/223609009567,수유역 이자카야 토라 가성비 안주 술집
https://blog.naver.com/dlwlsl__/223627859069,수유역 술집 2차로 가기 좋은 가성비 안주 맛집 이자카야 토라
https://blog.naver.com/wlgus960822/223640302175,"수유역가성비술집 이자카야 토라 : 오꼬노미야끼, 소고기타다끼, 나쵸플래터 후기"
https://blog.naver.com/ssoz_zang/223598489936,수유먹자골목 가성비 이자카야 맛집 <이자카야토라>수유점
https://blog.naver.com/qawsed0980/223508975171,일본이자카야 토라 안주추천 수유점 솔직후기
https://blog.naver.com/dd030_/223592887623,수유역이자카야 수유역가성비술집 강북구이자카야 수유리먹자골목맛집 이자카야 토라 술집 하이볼맛집
https://blog.naver.com/sunny970128/223345056787,수유 술집 새로 오픈한 이자카야 토라 수유점 메뉴 뿌시고 온 후기 내돈내산
https://blog.naver.com/ahddl0613/223360010038,"[수유 맛집] 초가성비 이자카야 '토라 수유점' 13,900원 모츠나베와 다양한 오코노미야끼"
https://blog.naver.com/blacklu/223571617465,수유역 가성비 좋은 술집 이자카야 토라
https://blog.naver.com/dakbalog/223667991047,아는 것이 힘입니다.
https://blog.naver.com/cnwjf200/223599160914,[수유] 이자카야 토라 수유가성비술집 솔직 후기!
https://blog.naver.com/workgyu/223496077138,Day 437
https://blog.naver.com/mj_m7/223467888261,수유 이자카야 토라
https://blog.naver.com/jet1016/223353153366,"[서울 수유] 방금 생긴 신상 가성비 이자카야 수유 술집 feat. 단체모임,헌팅술집 ()"
https://blog.naver.com/pge910909/223336144529,[수유역]이자카야 토라 / 오꼬노미야끼 감자전 굿굿
https://blog.naver.com/bearsjhj/223330161070,수유역 이자카야 토라 - 모츠나베 판다며?!
https://blog.naver.com/owerx/223347592471,수유역 술집 이자카야 토라 '내돈내산' 찐 후기
https://blog.naver.com/kitten1265/223586075262,쵸코쵸코룬
https://blog.naver.com/h_blair_/223516289607,"Feburary, 2024"
https://blog.naver.com/ayoung2702/223482572177,뒤죽박죽
https://blog.naver.com/rainbowtuna/223642696662,수유 곱창전골도 잘하는 임실순대국에서 점심먹기
https://blog.naver.com/iamhodu/223623893869,수유 곱창전골 임실순대국 서울피순대
https://blog.naver.com/kuleana/223540140893,[수유순대국] 수제 피순대가 수유에?? 임실순대국
https://blog.naver.com/ruddeo/223672967154,수유맛집 진한국물의 순대국과 수제피순대가 있는 임실순대국
https://blog.naver.com/chlwlldus1234/223630343034,"수유 곱창전골, 순댓국 맛집인 임실순대국 추천"
https://blog.naver.com/lovebomb1/223620868380,수유 순대국 임실순대국 수제 피순대 맛집 12시간 끓인 진한 육수
https://blog.naver.com/imthsu/223614102238,"수유 화계역 '임실순대국' 피순대를 파는 곱창전골, 순댓국 맛집"
https://blog.naver.com/rlagpwlszz/223615077860,수유맛집_해장하러갔다가 한잔하고 나올 수유곱창전골 맛집 임실순대국
https://blog.naver.com/forestlee21/223644362584,추운겨울 따듯한 돼지곱창전골 수유역곱창전골 임실순대국
https://blog.naver.com/goodneighor/223617383024,수유동 화계역 곱창전골맛집 직접 끓인 육수와 수제 피순대로 건강한 한끼 임실순대국
https://blog.naver.com/sooyoungparo7/223641309013,강북구순대국 임실순대국 국물과 담백 순대가 만나 찰떡꿍
https://blog.naver.com/chamchi37/223620445893,수유곱창전골에 피순대가 들어있는 수유맛집 임실순대국
https://blog.naver.com/with__mong/223605343272,수유곱창전골 12시간 직접 끓인 육수로 만든 임실순대국
https://blog.naver.com/yomoo_x/223558352094,"수유동맛집 임실순대국, 국물 진한 순대국과 피순대 조합 (feat. 오소리맛집)"
https://blog.naver.com/ggelatwo/223560355599,피순대 쩔어주는 수유국밥 임실순대국
https://blog.naver.com/ourlife-yolo/223553579580,가성비좋은 수유순대국 맛집 임실순대국
https://blog.naver.com/na_um7/223555276465,수유 국밥으로 해장하기 좋았던 임실순대국이에요
https://blog.naver.com/y2r_423/223590289425,수유 국밥 임실순대국 해장으로 너 딱정했어 ><
https://blog.naver.com/anstn1995/223540057898,[수유동맛집] 수유국밥집은 여기! '임실순대국' 찐 순대를 만날 수 있어요~
https://blog.naver.com/tmsla_zz/223531419029,[수유동 맛집] <임실순대국> 전주 안가도 맛볼 수 있는 직접만드는 피순대 맛집
https://blog.naver.com/alice__01/223578199576,수유맛집 직접 끓이는 일품 육수와 수제 피순대 임실순대국
https://blog.naver.com/rororong0830/223566242151,[수유맛집]머릿고기순대국 곱창순대국 임실순대국
https://blog.naver.com/mintpadi/223554153206,"임실순대국, 수유 국밥 피순대 맛집"
https://blog.naver.com/dwiches/223551589539,먹방 | 수유 순대국밥집 수제 피순대 맛집 임실순대국
https://blog.naver.com/notthatbad_/223528152987,수유 순대국 임실순대국 수제 피순대와 국밥이 찐으로 맛있는 수유동 맛집
https://blog.naver.com/qorvlffp/223325105503,[수유/화계] 순대국 찐맛집 추천 내돈내산 임실순대국
https://blog.naver.com/oak1431/222327603469,그집순대국 동두천점 테이블 교체 및 의자 설치 현장 포스팅
https://blog.naver.com/qwer8520-/223269733419,양주 커피머신렌탈 믹스VEN602S/VEN502 설치 후기 동두천
https://blog.naver.com/yckim0521/222946846558,전국의 가을여행 명소
https://blog.naver.com/hankyuldata/222221773489,2020년 7월 신규업소 자료
https://blog.naver.com/96_ijaewoo/223570642570,수유국밥 추천 수제 피순대를 먹을 수 있는 임실순대국
https://blog.naver.com/taxandtalk/222941464797,전국 음식점업-86
https://blog.naver.com/gangbuk_official/223285560614,[블로그 기자단] 2023 천변라이프 강북페스타 '우이천 빛나다' 야경 즐기며 메리크리스마스!
https://blog.naver.com/seoul-lee1m/223625241623,우이천 등 燈 축제 강북 꿈꾸는 물고기 서울 혼자 여행 야경 추천 혼자놀기 시원한곳
https://blog.naver.com/lastartsong/223543057805,"'서울을 따라서, 따릉이길 추천 공모전' 강북1등 강남 5등 수상 ㅎㅎ / 따릉이와 함게 하는 한강 여행..."
https://blog.naver.com/wngus0972/223148248338,"북악스카이웨이, 성북 강북에서 가기 좋은 서울 야경명소"
https://blog.naver.com/kskinline/223191604715,"[서울 강북 나들이 (2)] 광화문 광장 치맥과 구준엽 DJ 공연, 청계천 야경 사진과 영상 모음"
https://blog.naver.com/suntill0210/222766655063,서울 남산타워 (N서울타워) 야경 강북 종로 도심의 화려한 풍경들
https://blog.naver.com/mhjyt/223645515267,서강대교 인근 강북에서 바라본 여의도 야경
https://blog.naver.com/iamhankong/222539851983,한강 야경 즐기며 강남에서 강북까지 (ft. 한강라면)
https://blog.naver.com/kbinews/223106695981,[강북지역 명소] 야경이 아름다운 팔거천
https://blog.naver.com/yko53/223643972241,(석촌호수 야경)석촌호수 루미나리에빛축제아름다운 가족나들이 명소로 가볼만한 여행지 ^^~10.30
https://post.naver.com/viewer/postView.naver?volumeNo=34354994&memberNo=35869883&vType=VERTICAL,3년 만에 돌아온 ‘한강 야시장’…‘불토’엔 반포로!
https://blog.naver.com/difldifl1212/223060267086,우이천 벚꽃축제 빛 축제 음악분수대 벚꽃 강북 도봉 명소 우이천 벚꽃야경
https://blog.naver.com/kastia0075/223660465822,서울 렌트카 쏘카 근교 여행 서울 드라이브 야경 명소 추천
https://blog.naver.com/4julove/223671165112,"서울 강북 단풍 나들이: 청계천, 서울시청, 덕수궁 돌담길, 정동길, 광화문, 다시 청계천, 을지로~ 명동 & 남대문"
https://blog.naver.com/commu2015/223590694808,락톡 서울 드라이브 여행 북악스카이웨이 팔각정 야경 명소
https://blog.naver.com/joycevis/222554150209,"[강북구] 강북 시내를 한눈에 내려다 볼 수 있는 곳, 야경이 멋진 도선사!"
https://blog.naver.com/l2943989/222353018549,"낙산공원, 강북의 야경 맛집!"
https://blog.naver.com/mykbsmc2780/222922094215,[이벤트 종료] 강북삼성병원 야경사진 SNS 인증샷 이벤트
https://blog.naver.com/daldaltime_2021/222519847640,서울 강북 걷기좋은 공원 강북구 강아지와 가볼만한곳 저녁 산책 데이트 야경 멋진 북서울 꿈의숲
https://blog.naver.com/friday77/222305679249,서울 가볼만한곳 낙산공원 밤데이트 코스 (강북 야간 야경 명소)
https://blog.naver.com/dickprod/223082900584,(서울 종로구 / 조계사 야경) 서울 강북 한복판에서 만나보는 불교 사찰의 매력. 대한불교조계종의...
https://blog.naver.com/19power19/222354106367,한강의 성수대교를 넘어 강남으로 ... 밤이 되니 야경을 보며 다시 강북으로
https://blog.naver.com/inho1706/222362608896,강북 데이트코스 추천 문화 해설사와 함께하는 덕수궁 야경투어 정말 강추 (feat. 리에제와플)
https://blog.naver.com/honghwadam/222549411623,내가 사랑하는 강북 갬성의 야경
https://blog.naver.com/mamybebe/223618257554,서울 야경 명소 데이트 가볼만한 곳 걸어서 다녀온 남산서울타워 케이블카와 순환버스 정보
https://blog.naver.com/ibmlove/223655428748,한강공원 강남과 강북의 차이(gr3x)
https://blog.naver.com/ccc415000/223651006598,가을 강북5산 불수사도북 종주산행 도전
https://blog.naver.com/easyutopia/223658072541,[서울] 강북 5산 불수사도북 불암산 수락산 등산 후기
https://blog.naver.com/m45delps/223658528901,처음 가본 강북오산 (불암산-수락산-사패산-도봉산-북한산)-일명 불수사도북
https://blog.naver.com/sulmingg/223651108669,서울시티투어 버스 예약 노랑풍선 야간 가을 야경 드라이브 전통문화코스
https://blog.naver.com/bysthebest/223669489637,서울 이색 찜질방 데이트 추천 [스파렉스 동묘 동묘앞역] 강북 신상 1일 입장 2000평 헬스장 가격 9900원
https://blog.naver.com/officer34/223466189181,"[성당순례]강북천주교회, 와이탄성당[중국 닝보]"
https://blog.naver.com/6636ku/223549032607,강북삼성병원 수원검진센터 건강검진
https://blog.naver.com/mw9440/223646075219,불수사도북 - 강북5산 종주의 정석 오랜만에 다시 찾은 불수사도북 역시 힘들어 ~
https://blog.naver.com/sdasom/222937633774,"[강북삼성병원]도심 속 야경 정원, 야경 속 힐링 공간, 동문의 숲 별빛야행"
https://blog.naver.com/minibv/223419002821,MINI와 함께 떠나는 서울 야경 드라이브 코스
https://blog.naver.com/dakkuming/223626455724,"[240824-240825] 친구와 함께한 경주 1박2일 1일차 : 경주 황리단길, 야경산책"
https://blog.naver.com/nicejt21/223438461339,점취주-구곡교-고산-사주탑- 풍호서원-남호공원-남원-홍면도-백화주-조경문-수동가-보행가-동문 투어
https://blog.naver.com/kdjhmr/223457888092,[서울 성동구] 응봉산 팔각정에서 바라본 한강 야경 - 반포대교에서 롯데타워까지
https://blog.naver.com/ykan7/222538624975,2021-0819 한강터치 불수사도북 강북 5산 종주(뚝섬한강공원-공릉백세문-불암산-수락산-사패산-도봉산...
https://blog.naver.com/jin85_lee/223635388869,남한산성 서문 전망대 주차장 서울 야경 명소
https://blog.naver.com/drrespect/223005237590,강북 한강뷰 야경맛집 호텔나루 바 부아쟁 방문기
https://blog.naver.com/hyune0855/223604556737,한강 대교 별 야경 명소 러닝 자전거 코스 추천
https://blog.naver.com/enginepark/223607175819,24.10.02~03_강북5산종주(불수사도북)
https://blog.naver.com/oblove3/222611198971,서울야경 드라이브 이촌한강공원 여의도 더현대 서울 한강야경
https://blog.naver.com/pokara61/223106993397,아차산에서 본 서울의 황홀한 야경
https://blog.naver.com/l2lmrfox/222303767321,[여행] 서울시 구룡산의 야경
https://blog.naver.com/skydusik/222433903741,원효대교 야경과 주변 야경
https://blog.naver.com/chchqhqh/222524520192,노들섬 밤산책 한바퀴 야경 참 매력적이네요~
https://blog.naver.com/koreakm1106/222834495235,"[서울여행] 여의도 한강공원, 서울 야경"
https://blog.naver.com/yyhome53/222498686166,[홍천 관광] 홍천강의 야경 1
https://blog.naver.com/sunsu0403/223618593433,강북5산(북*도*사*수*불)종주
https://blog.naver.com/cognos57/222154262463,서울관광명소 서울구도심야경 숭례문 남대문시장 명동거리 명동성당 서울시청 서울광장
https://blog.naver.com/cayaeffy/223062221548,"[북악팔각정] 북악스카이웨이, 서울 강북의 오래된 드라이브 명소 야경 및 편의시설 +주차 정보"
https://blog.naver.com/marvelous37/223032797516,"이촌한강공원 / 노들섬 / 배달X / 테이크아웃(마녀김밥, 더피자사운즈) / 한강 / 직장인 맞춤"
https://blog.naver.com/he-one/222992449684,"강북/미아사거리 - 야경 맛집 닭발 맛집 ‘신라의 닭발’ 메뉴, 주차"
https://blog.naver.com/ddssjj0828/222937549288,[서대문역][서촌]야경맛집 강북삼성병원 아키비스트 서촌 아인슈페너 맛집 데이트
https://blog.naver.com/kki2427/223602720938,강북 아리랑힐 호텔 동대문 유용한 정보 및 후기
https://blog.naver.com/skfskf0827/222949525434,[서울/강북/노원]볼거리 많고 야경이 이쁜 노원불빛정원(+기차카페)
https://blog.naver.com/kikitravellife/223628095165,서울 야경 드라이브 응봉산 팔각정 주차 가는법 최단코스
